{
  "schema_version": 1,
  "session_id": "sess-001",
  "task_id": "task-001",
  "steps": [
    {
      "step_id": "step-001",
      "status": "completed",
      "verification_status": "VERIFIED",
      "summary": "Created folder",
      "reason": "Directory evidence matched the signed authorization."
    }
  ]
}